tvm/topi/tests/python/tvm-gpu/cnn-bench/resnet-50.log.tmp
{"i": ["cuda -model=unknown", "topi_nn_conv2d", [["TENSOR", [1, 8, 8, 2048], "float16"], ["TENSOR", [512, 1, 1, 2048], "float16"], [1, 1], [0, 0], [1, 1], "NHWC", "float16"], {}, ["conv2d", [1, 8, 8, 2048, "float16"], [512, 1, 1, 2048, "float16"], [1, 1], [0, 0], [1, 1], "NHWC", "float16"], {"i": 15858164, "c": null, "e": [["n_cut", "sp", [1, 1, 1, 1]], ["p_cut", "sp", [4, 1, 2, 1]], ["q_cut", "sp", [1, 2, 4, 1]], ["k_cut", "sp", [8, 1, 64, 1]], ["rr_cut", "sp", [1, 1]], ["rs_cut", "sp", [1, 1]], ["rc_cut", "sp", [256, 2, 4]], ["Data_sh_buf", "ot", 0], ["kernel_sh_buf", "ot", 1]], "t": "fp16"}], "r": [[0.00025847575], 0, 0.6255190372467041, 1550806689.989694], "v": 0.1}
{"i": ["cuda -model=unknown", "topi_nn_conv2d", [["TENSOR", [1, 8, 8, 2048], "float16"], ["TENSOR", [512, 1, 1, 2048], "float16"], [1, 1], [0, 0], [1, 1], "NHWC", "float16"], {}, ["conv2d", [1, 8, 8, 2048, "float16"], [512, 1, 1, 2048, "float16"], [1, 1], [0, 0], [1, 1], "NHWC", "float16"], {"i": 9343133, "c": null, "e": [["n_cut", "sp", [1, 1, 1, 1]], ["p_cut", "sp", [2, 1, 2, 2]], ["q_cut", "sp", [2, 1, 1, 4]], ["k_cut", "sp", [4, 8, 16, 1]], ["rr_cut", "sp", [1, 1]], ["rs_cut", "sp", [1, 1]], ["rc_cut", "sp", [16, 32, 4]], ["Data_sh_buf", "ot", 1], ["kernel_sh_buf", "ot", 0]], "t": "fp16"}], "r": [[0.00069223425], 0, 0.8161320686340332, 1550806690.524485], "v": 0.1}
{"i": ["cuda -model=unknown", "topi_nn_conv2d", [["TENSOR", [1, 8, 8, 2048], "float16"], ["TENSOR", [512, 1, 1, 2048], "float16"], [1, 1], [0, 0], [1, 1], "NHWC", "float16"], {}, ["conv2d", [1, 8, 8, 2048, "float16"], [512, 1, 1, 2048, "float16"], [1, 1], [0, 0], [1, 1], "NHWC", "float16"], {"i": 15897203, "c": null, "e": [["n_cut", "sp", [1, 1, 1, 1]], ["p_cut", "sp", [1, 8, 1, 1]], ["q_cut", "sp", [8, 1, 1, 1]], ["k_cut", "sp", [32, 1, 2, 8]], ["rr_cut", "sp", [1, 1]], ["rs_cut", "sp", [1, 1]], ["rc_cut", "sp", [256, 2, 4]], ["Data_sh_buf", "ot", 0], ["kernel_sh_buf", "ot", 1]], "t": "fp16"}], "r": [[0.000460424], 0, 0.7409267425537109, 1550806691.048415], "v": 0.1}
{"i": ["cuda -model=unknown", "topi_nn_conv2d", [["TENSOR", [1, 8, 8, 2048], "float16"], ["TENSOR", [512, 1, 1, 2048], "float16"], [1, 1], [0, 0], [1, 1], "NHWC", "float16"], {}, ["conv2d", [1, 8, 8, 2048, "float16"], [512, 1, 1, 2048, "float16"], [1, 1], [0, 0], [1, 1], "NHWC", "float16"], {"i": 1521754, "c": null, "e": [["n_cut", "sp", [1, 1, 1, 1]], ["p_cut", "sp", [1, 2, 2, 2]], ["q_cut", "sp", [2, 1, 4, 1]], ["k_cut", "sp", [128, 1, 2, 2]], ["rr_cut", "sp", [1, 1]], ["rs_cut", "sp", [1, 1]], ["rc_cut", "sp", [32, 32, 2]], ["Data_sh_buf", "ot", 0], ["kernel_sh_buf", "ot", 0]], "t": "fp16"}], "r": [[0.0004812195], 0, 0.615973949432373, 1550806691.865207], "v": 0.1}
